评论ID,评论时间,评论内容,评论得分,用户昵称,商品_颜色,商品_型号,清洗后评论,分词,关键词,情感得分,情感标签
25011970066,2025-11-15 11:46:17,Pura70手机到手后，第一感觉就是外观设计非常精致，握在手里大小正合适，边角圆润不割手。屏幕显示效果细腻，色彩还原度高，看视频玩游戏都很享受。性能方面，运行速度流畅，多任务处理毫无压力，大型游戏也能轻松应对。拍照功能更是让我惊喜，无论是白天还是夜晚，成像效果都很出色，细节丰富。电池续航能力强，满足我一天的使用需求。总体来说，这是一款性价比很高的手机。,5,0***呀,羽砂黑,12GB+512GB,Pura70手机到手后 第一感觉就是外观设计非常精致 握在手里大小正合适 边角圆润不割手 屏幕显示效果细腻 色彩还原度高 看视频玩游戏都很享受 性能方面 运行速度流畅 多任务处理毫无压力 大型游戏也能轻松应对 拍照功能更是让我惊喜 无论是白天还是夜晚 成像效果都很出色 细节丰富 电池续航能力强 满足我一天的使用需求 总体来说 这是一款性价比很高的手机,"['Pura70', '手机', '到手', '第一', '外观设计', '精致', '手里', '大小', '正合适', '边角', '圆润', '割手', '屏幕显示', '效果', '细腻', '色彩', '还原', '度高', '视频', '玩游戏', '享受', '性能', '方面', '运行', '速度', '流畅', '多任务处理', '毫无', '压力', '大型', '游戏', '轻松', '应对', '拍照', '功能', '更是', '惊喜', '无论是', '白天', '夜晚', '成像', '效果', '出色', '细节', '丰富', '电池', '续航', '能力', '满足', '一天', '使用', '需求', '总体', '来说', '这是', '一款', '性价比', '手机']","['割手', '手机', 'Pura70', '度高', '多任务处理']",1.0,正向
102634430138650208,2025-11-20 20:49:14,之前买过一部华为P40   用了好多年了   电池和内存都不行了  这次换手机还是选华为的   京东自营正品   物流很快  P70外观好看   有质感   操作流畅   用了一个来月了   没出现问题,5,e***a,羽砂黑,12GB+512GB,之前买过一部华为P40 用了好多年了 电池和内存都不行了 这次换手机还是选华为的 京东自营正品 物流很快 P70外观好看 有质感 操作流畅 用了一个来月了 没出现问题,"['之前', '买过', '一部', '华为', 'P40', '好多年', '电池', '内存', '不行', '这次', '手机', '华为', '京东', '自营', '正品', '很快', 'P70', '外观', '好看', '质感', '操作', '流畅', '一个', '出现', '问题']","['华为', 'P40', 'P70', '正品', '买过']",0.9984517357524976,正向
102910840149167392,2025-11-26 09:14:59,拍照神器，随手出大片！ 夜景和人像效果绝了，朋友圈点赞收割机。 续航给力，告别电量焦虑！ 重度使用一天一充完全没问题，快充速度惊人。 颜值天花板，手感一流！ 这设计和质感，拿在手里就是一种享受。,5,思加图001,雪域白,12GB+512GB,拍照神器 随手出大片 夜景和人像效果绝了 朋友圈点赞收割机 续航给力 告别电量焦虑 重度使用一天一充完全没问题 快充速度惊人 颜值天花板 手感一流 这设计和质感 拿在手里就是一种享受,"['拍照', '神器', '随手', '大片', '夜景', '效果', '朋友', '圈点', '收割机', '续航', '给力', '告别', '电量', '焦虑', '重度', '使用', '一天', '一充', '完全', '问题', '快充', '速度', '惊人', '颜值', '天花板', '手感', '一流', '设计', '质感', '手里', '一种', '享受']","['给力', '一充', '快充', '颜值', '圈点']",0.9999996290999954,正向
25001976081,2025-11-13 23:24:18,我最近入手的这款手机，简直是宝藏!外观设计时尚，线条流畅，握感舒适。屏幕显示清晰，色彩鲜艳，视觉体验超棒。性能更是强劲，运行速度快，多任务处理也不卡顿。拍照功能也很出色，拍出的照片画质清晰、色彩还原度高。价格还实惠，性价比无敌，爱了爱了👍,5,l***-,羽砂黑,12GB+512GB,我最近入手的这款手机 简直是宝藏 外观设计时尚 线条流畅 握感舒适 屏幕显示清晰 色彩鲜艳 视觉体验超棒 性能更是强劲 运行速度快 多任务处理也不卡顿 拍照功能也很出色 拍出的照片画质清晰 色彩还原度高 价格还实惠 性价比无敌 爱了爱了,"['最近', '入手', '这款', '手机', '简直', '宝藏', '外观设计', '时尚', '线条', '流畅', '握感', '舒适', '屏幕显示', '清晰', '色彩鲜艳', '视觉', '体验', '超棒', '性能', '更是', '强劲', '运行', '速度', '多任务处理', '不卡顿', '拍照', '功能', '出色', '拍出', '照片', '画质', '清晰', '色彩', '还原', '度高', '实惠', '性价比', '无敌']","['清晰', '握感', '超棒', '多任务处理', '不卡顿']",1.0,正向
24967677173,2025-11-10 12:45:18,作为摄影爱好者，这款华为手机的影像系统彻底征服了我。可变光圈和长焦镜头非常专业，无论是拍风景还是人像，细节和色彩还原都极其出色。尤其是夜景模式，手持就能拍出非常纯净明亮的照片，效果堪比相机。系统流畅，充电速度也快。如果你对拍照有高要求，选它绝对没错！,5,门口丂,羽砂黑,12GB+512GB,作为摄影爱好者 这款华为手机的影像系统彻底征服了我 可变光圈和长焦镜头非常专业 无论是拍风景还是人像 细节和色彩还原都极其出色 尤其是夜景模式 手持就能拍出非常纯净明亮的照片 效果堪比相机 系统流畅 充电速度也快 如果你对拍照有高要求 选它绝对没错,"['作为', '摄影', '爱好者', '华为', '手机', '影像', '系统', '彻底', '征服', '可变', '光圈', '长焦', '镜头', '专业', '无论是', '风景', '人像', '细节', '色彩', '还原', '极其', '出色', '尤其', '夜景', '模式', '手持', '拍出', '纯净', '明亮', '照片', '效果', '堪比', '相机', '系统', '流畅', '充电', '速度', '拍照', '要求', '选它', '绝对', '没错']","['长焦', '堪比', '选它', '光圈', '拍出']",0.999999988916814,正向
102640560144592608,2025-11-21 11:14:09,终于拿到了期待已久的华为Pura 70！手感一流，颜值太能打了，绝对是手机界的颜值担当。最让我惊艳的是它的影像能力，随手一拍就是大片，细节和色彩都超级棒。鸿蒙系统运行丝滑流畅，操作起来非常跟手。续航也很给力，配合超快充电，一天下来毫无压力。从下单到收货，京东物流一如既往地快。非常满意的一次购物，国货之光，强烈推荐！,5,shimian_plus,雪域白,12GB+512GB,终于拿到了期待已久的华为Pura 70 手感一流 颜值太能打了 绝对是手机界的颜值担当 最让我惊艳的是它的影像能力 随手一拍就是大片 细节和色彩都超级棒 鸿蒙系统运行丝滑流畅 操作起来非常跟手 续航也很给力 配合超快充电 一天下来毫无压力 从下单到收货 京东物流一如既往地快 非常满意的一次购物 国货之光 强烈推荐,"['终于', '拿到', '期待已久', '华为', 'Pura', '70', '手感', '一流', '颜值', '太能', '绝对', '手机', '颜值', '担当', '惊艳', '影像', '能力', '随手', '一拍', '大片', '细节', '色彩', '超级', '鸿蒙', '系统', '运行', '丝滑', '流畅', '操作', '起来', '跟手', '续航', '配合', '超快', '充电', '一天', '下来', '毫无', '压力', '下单', '收货', '京东', '一如既往', '地快', '满意', '一次', '购物', '国货', '之光', '强烈推荐']","['颜值', 'Pura', '70', '太能', '丝滑']",0.9999999989871247,正向
103033870145155600,2025-11-19 21:16:06,这么多年，一直用华为手机。使用体验很好，运行速度很快，拍照效果很好，外形也美观大方。旧机和新机手机克隆很方便，所有数据完美迁移，完全没有换机感觉，非常满意。,5,jd_如风的思,羽砂黑,12GB+512GB,这么多年 一直用华为手机 使用体验很好 运行速度很快 拍照效果很好 外形也美观大方 旧机和新机手机克隆很方便 所有数据完美迁移 完全没有换机感觉 非常满意,"['这么', '多年', '一直', '华为', '手机', '使用', '体验', '运行', '速度', '很快', '拍照', '效果', '外形', '美观大方', '旧机', '新机', '手机', '克隆', '方便', '所有', '数据', '完美', '迁移', '完全', '换机', '满意']","['手机', '换机', '旧机', '美观大方', '新机']",0.9999999434867216,正向
24998082740,2025-11-13 16:59:41,一直以来都是华为手机的铁粉。最近换了这款雪域白，亮点实在太多了。外观时尚漂亮，储存空间超大，拍摄清晰度高。信号稳定，不受干扰，在没有地面网络时还能发送和接收卫星消息。感觉配置大大提高了，很赞！,5,a***2,雪域白,12GB+512GB,一直以来都是华为手机的铁粉 最近换了这款雪域白 亮点实在太多了 外观时尚漂亮 储存空间超大 拍摄清晰度高 信号稳定 不受干扰 在没有地面网络时还能发送和接收卫星消息 感觉配置大大提高了 很赞,"['一直', '以来', '华为', '手机', '铁粉', '最近', '这款', '雪域', '亮点', '实在', '太多', '外观', '时尚', '漂亮', '储存', '空间', '超大', '拍摄', '清晰度', '信号', '稳定', '干扰', '地面', '网络', '发送', '接收', '卫星', '消息', '配置', '大大提高', '很赞']","['很赞', '铁粉', '雪域', '清晰度', '华为']",0.9956917890365851,正向
25016521124,2025-11-15 23:09:02,京东的速度发货就是快，第2天一收到货就立马开机使用，还是很喜欢P70这个摄像头的样子，很酷。拍照用起来也很丝滑，高清远景拍摄之后，再放大来看，没有像以前的相机一放大就出那种马赛克的质感，这个手机拍出来的放大了看也还是很清晰的。对此很满意。,5,橘***儿,雪域白,12GB+512GB,京东的速度发货就是快 第2天一收到货就立马开机使用 还是很喜欢P70这个摄像头的样子 很酷 拍照用起来也很丝滑 高清远景拍摄之后 再放大来看 没有像以前的相机一放大就出那种马赛克的质感 这个手机拍出来的放大了看也还是很清晰的 对此很满意,"['京东', '速度', '发货', '天一', '收到', '立马', '开机', '使用', '喜欢', 'P70', '这个', '摄像头', '样子', '很酷', '拍照', '起来', '高清', '远景', '拍摄', '之后', '放大', '来看', '以前', '相机', '放大', '那种', '马赛克', '质感', '这个', '手机', '出来', '放大', '清晰', '对此', '满意']","['放大', '很酷', 'P70', '马赛克', '发货']",0.997745311339805,正向
103172690155112400,2025-11-15 16:19:43,一直是华为用户，用过几款手机都耐用耐摔。这款手机的设计我很喜欢，简约又时尚，日常使用流畅，拍照效果也不错，很值得入手。,5,jd_83nt44dr4fknwi,雪域白,12GB+512GB,一直是华为用户 用过几款手机都耐用耐摔 这款手机的设计我很喜欢 简约又时尚 日常使用流畅 拍照效果也不错 很值得入手,"['一直', '华为', '用户', '用过', '几款', '手机', '耐用', '手机', '设计', '喜欢', '简约', '时尚', '日常', '使用', '流畅', '拍照', '效果', '不错', '值得', '入手']","['手机', '几款', '华为', '简约', '拍照']",0.9999999200435905,正向
24936044462,2025-11-06 20:30:08,启动很快，操作很顺畅，待机时间一天没问题。看起来很有质感。外放声音也很不错。颜值也很高，就是没有国补，其他的都很好。,5,陈***7,雪域白,12GB+512GB,启动很快 操作很顺畅 待机时间一天没问题 看起来很有质感 外放声音也很不错 颜值也很高 就是没有国补 其他的都很好,"['启动', '很快', '操作', '顺畅', '待机时间', '一天', '问题', '看起来', '质感', '外放', '声音', '不错', '颜值', '国补', '其他']","['待机时间', '颜值', '国补', '外放', '质感']",0.9998170396255002,正向
24865888115,2025-10-30 08:54:47,一直购买，华为 P 系列产品，大品牌的产品质量保证！软件启动超级快，待机时间很长，屏幕显示流畅不卡顿，京东自营旗舰店购买产品质量保证！,5,曾***軍,羽砂黑,12GB+512GB,一直购买 华为 P 系列产品 大品牌的产品质量保证 软件启动超级快 待机时间很长 屏幕显示流畅不卡顿 京东自营旗舰店购买产品质量保证,"['一直', '购买', '华为', '系列产品', '品牌', '产品质量', '保证', '软件', '启动', '超级', '待机时间', '很长', '屏幕显示', '流畅', '不卡顿', '京东', '自营', '旗舰店', '购买', '产品质量', '保证']","['产品质量', '待机时间', '不卡顿', '屏幕显示', '购买']",0.9993820791555337,正向
103292450157847600,2025-11-26 23:37:21,"外形外观：很好的，非常喜欢。
屏幕音效：挺好的
拍照效果：很好的
运行速度：不错的
待机时间：OK的。
其他特色：好啊。很喜欢非常喜欢特别喜欢超级喜欢。",5,gCbvIBKyhZJk,羽砂黑,12GB+512GB,外形外观 很好的 非常喜欢 屏幕音效 挺好的 拍照效果 很好的 运行速度 不错的 待机时间 OK的 其他特色 好啊 很喜欢非常喜欢特别喜欢超级喜欢,"['外形', '外观', '喜欢', '屏幕', '音效', '拍照', '效果', '运行', '速度', '不错', '待机时间', 'OK', '其他', '特色', '喜欢', '喜欢', '特别', '喜欢', '超级', '喜欢']","['喜欢', '待机时间', '音效', 'OK', '非常']",0.9999999913185164,正向
24884565854,2025-11-01 11:56:21,颜值很高很喜欢很流畅，一点也不卡从mate40换过来的m40用了4年还是那么坚挺，看了好久感觉这个颜值好高很不错！很有颜值！！！,5,LCY66666666,羽砂黑,12GB+512GB,颜值很高很喜欢很流畅 一点也不卡从mate40换过来的m40用了4年还是那么坚挺 看了好久感觉这个颜值好高很不错 很有颜值,"['颜值', '喜欢', '流畅', '一点', '不卡', 'mate40', '换过来', 'm40', '那么', '坚挺', '好久', '这个', '颜值', '不错', '颜值']","['颜值', '不卡', 'mate40', '换过来', 'm40']",0.9999619334307583,正向
103280310157240800,2025-11-25 10:54:14,这次购物非常愉快！商品实惠好用，质量上乘。物流迅速，商家服务热情，售后无忧。质量杠杠的，设计美观大方，商家服务赞，穿上体验很棒，物流服务好，性价比高，爱了爱了！这次购物体验超棒，商品性价比高，质量优秀。物流高效快捷，商家服务周到，售后完善。,5,jd_FSWJ464,羽砂黑,12GB+512GB,这次购物非常愉快 商品实惠好用 质量上乘 物流迅速 商家服务热情 售后无忧 质量杠杠的 设计美观大方 商家服务赞 穿上体验很棒 物流服务好 性价比高 爱了爱了 这次购物体验超棒 商品性价比高 质量优秀 物流高效快捷 商家服务周到 售后完善,"['这次', '购物', '愉快', '实惠', '好用', '质量上乘', '迅速', '商家', '服务', '热情', '售后', '无忧', '杠杠', '设计', '美观大方', '商家', '服务', '体验', '很棒', '服务', '性价比', '这次', '购物', '体验', '超棒', '性价比', '优秀', '高效快捷', '商家', '服务周到', '售后', '完善']","['商家', '物流', '售后', '性价比', '服务']",0.9999999999520239,正向
24936811574,2025-11-06 21:56:10,犹豫了好久，最后决定买P70，实在是不敢用鸿蒙五。刚用了一个多小时，挪了机，非常方便。原来用Mate60 Pro对于女生来讲还是觉得大，这个很好，最有趣的是退过一次货，选择理由是其他平台便宜，结果晚睡前就发现了这个便宜了将近1000的同款同内存同色，还是京东自营，好奇妙,5,j***购,雪域白,12GB+512GB,犹豫了好久 最后决定买P70 实在是不敢用鸿蒙五 刚用了一个多小时 挪了机 非常方便 原来用Mate60 Pro对于女生来讲还是觉得大 这个很好 最有趣的是退过一次货 选择理由是其他平台便宜 结果晚睡前就发现了这个便宜了将近1000的同款同内存同色 还是京东自营 好奇妙,"['犹豫', '好久', '最后', '决定', 'P70', '实在', '不敢', '鸿蒙', '刚用', '一个多', '小时', '方便', '原来', 'Mate60', 'Pro', '对于', '女生', '来讲', '觉得', '这个', '有趣', '退过', '一次', '选择', '理由', '其他', '平台', '便宜', '结果', '晚睡', '发现', '这个', '便宜', '将近', '1000', '同款', '内存', '同色', '京东', '自营', '奇妙']","['便宜', 'P70', '刚用', 'Mate60', 'Pro']",0.5056694374839471,中性
102970410151805296,2025-11-28 11:32:23,给老妈买的这款手机拍照清晰，她用着很顺手。外观简约大方，操作简单易上手，电池续航也不错，拍照好看，性价比超高，很值得购买。,5,丶***逗,雪域白,12GB+512GB,给老妈买的这款手机拍照清晰 她用着很顺手 外观简约大方 操作简单易上手 电池续航也不错 拍照好看 性价比超高 很值得购买,"['老妈', '这款', '手机', '拍照', '清晰', '顺手', '外观', '简约', '大方', '操作', '简单', '易上', '电池', '续航', '不错', '拍照', '好看', '性价比', '超高', '值得', '购买']","['拍照', '易上', '老妈', '简约', '超高']",0.9999999998895526,正向
25020252445,2025-11-16 16:59:35,试用了几天才来评价的，个人比较喜欢直面屏，所以很中意P70，对显示效果、使用手感还有流畅度都比较满意，京东价格也比实体店划算，放心买，再配上个好看的手机壳，很喜欢！,5,Tmoon月,雪域白,12GB+512GB,试用了几天才来评价的 个人比较喜欢直面屏 所以很中意P70 对显示效果 使用手感还有流畅度都比较满意 京东价格也比实体店划算 放心买 再配上个好看的手机壳 很喜欢,"['试用', '几天', '评价', '个人', '喜欢', '直面', '中意', 'P70', '显示', '效果', '使用', '手感', '还有', '流畅', '比较满意', '京东', '实体店', '划算', '放心', '再配', '好看', '手机', '喜欢']","['P70', '喜欢', '实体店', '比较满意', '再配']",0.9998641919333943,正向
24899152317,2025-11-03 00:01:15,考虑了很久才买了这款华为P70，收到货后迫不及待的打开，屏幕玻璃是防摔的，硬度比我之前用的手机都要硬，比较意外的是还送了个手机套，电池带机还是非常给力,5,u_nr6kltos9lxo,冰晶蓝,12GB+512GB,考虑了很久才买了这款华为P70 收到货后迫不及待的打开 屏幕玻璃是防摔的 硬度比我之前用的手机都要硬 比较意外的是还送了个手机套 电池带机还是非常给力,"['考虑', '这款', '华为', 'P70', '收到', '货后', '迫不及待', '打开', '屏幕', '玻璃', '硬度', '之前', '手机', '意外', '手机套', '电池', '带机', '给力']","['带机', '手机套', 'P70', '货后', '给力']",0.8415819654779295,正向
24898702716,2025-11-02 22:27:44,质量太好了特别有质感给老人买的非常喜欢手机很有重量感，音质很棒，尤其是像素非常棒还有美颜那美颜绝绝子也不假。非常好华为我们的最爱。,5,宠物控心_福至x4973,雪域白,12GB+512GB,质量太好了特别有质感给老人买的非常喜欢手机很有重量感 音质很棒 尤其是像素非常棒还有美颜那美颜绝绝子也不假 非常好华为我们的最爱,"['太好了', '特别', '质感', '老人', '喜欢', '手机', '重量', '音质', '很棒', '尤其', '像素', '还有', '美颜', '美颜', '绝绝子', '不假', '华为', '我们']","['美颜', '非常', '绝绝子', '像素', '很棒']",0.9999856341798976,正向
103032290151954000,2025-11-22 11:43:27,确实好用，屏幕也好看，摄像清晰，很有感觉(❁&acute;◡`❁)*✲ﾟ*运行很流畅，甩烂苹果100年，信号也好，电梯都有信号(❁&acute;◡`❁)*✲ﾟ*(❁&acute;◡`❁)*✲ﾟ*,5,tp0u6963px1cl2,雪域白,12GB+512GB,确实好用 屏幕也好看 摄像清晰 很有感觉 acute 运行很流畅 甩烂苹果100年 信号也好 电梯都有信号 acute acute,"['确实', '好用', '屏幕', '好看', '摄像', '清晰', 'acute', '运行', '流畅', '甩烂', '苹果', '100', '信号', '也好', '电梯', '信号', 'acute', 'acute']","['acute', '信号', '甩烂', '100', '好用']",0.9982784068921247,正向
24998201202,2025-11-13 17:13:54,这款三星p70 手机已经使用几几个月了，使用效果非常好手感也很好，不大不小拿在手上没有那么笨重，速度也很快。总之华为的手机非常满意,5,一只丫723,羽砂黑,12GB+512GB,这款三星p70 手机已经使用几几个月了 使用效果非常好手感也很好 不大不小拿在手上没有那么笨重 速度也很快 总之华为的手机非常满意,"['三星', 'p70', '手机', '使用', '几个', '使用', '效果', '手感', '不大不小', '拿在手上', '那么', '笨重', '速度', '很快', '总之', '华为', '手机', '满意']","['手机', 'p70', '拿在手上', '不大不小', '华为']",0.9968975871016917,正向
25005215686,2025-11-14 13:46:54,&ldquo;宝贝收到了，包装很严实。实物和图片一模一样，没有色差。材质摸起来很舒服，做工精细，没有线头，这个价格能买到这样的质量太值了！,5,j***h,雪域白,12GB+512GB,ldquo 宝贝收到了 包装很严实 实物和图片一模一样 没有色差 材质摸起来很舒服 做工精细 没有线头 这个价格能买到这样的质量太值了,"['ldquo', '宝贝', '收到', '严实', '实物', '图片', '一模一样', '色差', '材质', '起来', '舒服', '做工', '精细', '线头', '这个', '这样', '太值']","['ldquo', '太值', '色差', '线头', '严实']",0.7583451099649396,正向
103164890148280000,2025-11-14 23:06:52,外观精美 材质舒适 使用效果好 流畅度很高 内存容量大 大小合适手感很好 物流速度快 质量有保障 白色精致干净 非常适合当做礼物送人 好评！,5,S***e,雪域白,12GB+512GB,外观精美 材质舒适 使用效果好 流畅度很高 内存容量大 大小合适手感很好 物流速度快 质量有保障 白色精致干净 非常适合当做礼物送人 好评,"['外观', '精美', '材质', '舒适', '使用', '效果', '流畅', '内存容量', '大小', '合适', '手感', '速度', '保障', '白色', '精致', '干净', '非常适合', '当做', '礼物', '送人', '好评']","['内存容量', '送人', '非常适合', '手感', '材质']",0.9999999938012039,正向
102983800146025200,2025-11-24 15:19:09,用了一段时间才来评价的，手感很好，大小合适，使用系统非常流畅，拍照清晰自然，北斗卫星功能强大，很满意。,5,j***a,羽砂黑,12GB+512GB,用了一段时间才来评价的 手感很好 大小合适 使用系统非常流畅 拍照清晰自然 北斗卫星功能强大 很满意,"['一段时间', '评价', '手感', '大小', '合适', '使用', '系统', '流畅', '拍照', '清晰', '自然', '北斗', '卫星', '功能强大', '满意']","['功能强大', '北斗', '手感', '拍照', '流畅']",0.999981861936583,正向
103284140151779008,2025-11-26 18:17:58,相当不错啊。手感比我的mate60好一些。确实漂亮。也没啥瑕疵。双持华为。摸鱼来的。这次国补比我买mate60还便宜。,5,胖***g,雪域白,12GB+512GB,相当不错啊 手感比我的mate60好一些 确实漂亮 也没啥瑕疵 双持华为 摸鱼来的 这次国补比我买mate60还便宜,"['相当', '不错', '手感', 'mate60', '一些', '确实', '漂亮', '瑕疵', '双持', '华为', '摸鱼', '这次', '国补', 'mate60', '便宜']","['mate60', '双持', '国补', '摸鱼', '华为']",0.9992506776801746,正向
103173550148150400,2025-11-27 09:12:39,"好用
外形外观：很满意不厚也不重
屏幕音效：屏幕清晰，音质好
拍照效果：嘎嘎够用
运行速度：新手机必须快
待机时间：一天一冲吧，反正",5,狄***9,雪域白,12GB+512GB,好用 外形外观 很满意不厚也不重 屏幕音效 屏幕清晰 音质好 拍照效果 嘎嘎够用 运行速度 新手机必须快 待机时间 一天一冲吧 反正,"['好用', '外形', '外观', '满意', '不厚', '不重', '屏幕', '音效', '屏幕', '清晰', '音质', '拍照', '效果', '嘎嘎', '够用', '运行', '速度', '新手机', '必须', '待机时间', '一天', '一冲', '反正']","['屏幕', '待机时间', '音效', '不厚', '新手机']",0.9999965119327429,正向
25011566813,2025-11-15 10:40:55,华为pura系列的手机拍照效果还是很出色的，放大20倍拍照都很清晰，新机充电快，使用不发热，可以一天多充一次电。,5,jd_718610726,雪域白,12GB+512GB,华为pura系列的手机拍照效果还是很出色的 放大20倍拍照都很清晰 新机充电快 使用不发热 可以一天多充一次电,"['华为', 'pura', '系列', '手机', '拍照', '效果', '出色', '放大', '20', '拍照', '清晰', '新机', '充电', '使用', '发热', '一天', '多充', '一次']","['拍照', 'pura', '20', '多充', '新机']",0.994278600968306,正向
