评论ID,评论时间,评论内容,评论得分,用户昵称,商品_颜色,商品_型号,清洗后评论,分词,关键词,情感得分,情感标签
22808274924,2025-04-03 10:35:47,"非常感谢京东，非常的实惠，非常感谢京东，选择标准版就是因为外观非常好看，颜值高，摸着有质感。抓拍之下图片非常清晰且好看，清晰度高，体验感很好，微距体验好。        感谢京东， 我非常的喜欢这款手机，非常的好用，心心念念的手机终于到了，用了很长时间的曲面屏手机，这款直屏手机实在是太喜欢了，买的白色，好看大气，拍照效果很棒，抓拍很方便，拍出来美美的，微距效果更赞，以后可以美美的拍照啦选择标准版就是因为外观非常好看，颜值高，摸着有质感。抓拍之下图片非常清晰且好看，清晰度高，体验感很好，微距体验好。买了华为 pura70，白色，256g 内存
手机外观挺精致的，手感不错，外观无瑕疵。
像素也挺好的，拍照很好看。想了很久的新手机，外观漂亮，手感超级棒，尤其对于我这种拍照狂来说，简直太赞了。试了一下微距和夜景，画面超清晰，抓拍的马路夜景也很有氛围感，超级棒！从开快递包装的那一刻起，华为Pura 70就以其精致的设计、卓越的性能深深吸引了我。这款手机不仅外观时尚大气，拿在手中更是质感满满，每一次滑动都是享受",5,科***2,雪域白,12GB+512GB,非常感谢京东 非常的实惠 非常感谢京东 选择标准版就是因为外观非常好看 颜值高 摸着有质感 抓拍之下图片非常清晰且好看 清晰度高 体验感很好 微距体验好 感谢京东 我非常的喜欢这款手机 非常的好用 心心念念的手机终于到了 用了很长时间的曲面屏手机 这款直屏手机实在是太喜欢了 买的白色 好看大气 拍照效果很棒 抓拍很方便 拍出来美美的 微距效果更赞 以后可以美美的拍照啦选择标准版就是因为外观非常好看 颜值高 摸着有质感 抓拍之下图片非常清晰且好看 清晰度高 体验感很好 微距体验好 买了华为 pura70 白色 256g 内存 手机外观挺精致的 手感不错 外观无瑕疵 像素也挺好的 拍照很好看 想了很久的新手机 外观漂亮 手感超级棒 尤其对于我这种拍照狂来说 简直太赞了 试了一下微距和夜景 画面超清晰 抓拍的马路夜景也很有氛围感 超级棒 从开快递包装的那一刻起 华为Pura 70就以其精致的设计 卓越的性能深深吸引了我 这款手机不仅外观时尚大气 拿在手中更是质感满满 每一次滑动都是享受,"['非常感谢', '京东', '实惠', '非常感谢', '京东', '选择', '标准版', '外观', '好看', '颜值', '质感', '抓拍', '之下', '图片', '清晰', '好看', '清晰度', '体验', '微距', '体验', '感谢', '京东', '喜欢', '手机', '心心念念', '手机', '终于', '长时间', '曲面', '手机', '这款', '直屏', '手机', '实在', '喜欢', '白色', '好看', '大气', '拍照', '效果', '很棒', '抓拍', '方便', '出来', '美美', '微距', '效果', '更赞', '以后', '美美', '拍照', '选择', '标准版', '外观', '好看', '颜值', '质感', '抓拍', '之下', '图片', '清晰', '好看', '清晰度', '体验', '微距', '体验', '华为', 'pura70', '白色', '256g', '内存', '手机', '外观', '精致', '手感', '不错', '外观', '瑕疵', '像素', '拍照', '好看', '新手机', '外观', '漂亮', '手感', '超级', '尤其', '对于', '这种', '拍照', '来说', '简直', '太赞', '一下', '微距', '夜景', '画面', '清晰', '抓拍', '马路', '夜景', '氛围', '超级', '从开', '一刻起', '华为', 'Pura', '70', '精致', '设计', '卓越', '性能', '深深', '吸引', '手机', '不仅', '外观', '时尚', '大气', '手中', '更是', '质感', '满满', '一次', '滑动', '享受']","['微距', '抓拍', '外观', '好看', '手机']",1.0,正向
22453966112,2025-02-27 15:31:02,外形外观非常喜欢，屏幕音效特别好，拍照效果非常非常好，运行速度非常快，待机时间长。支持华为手机。,5,j***n,冰晶蓝,12GB+512GB,外形外观非常喜欢 屏幕音效特别好 拍照效果非常非常好 运行速度非常快 待机时间长 支持华为手机,"['外形', '外观', '喜欢', '屏幕', '音效', '特别', '拍照', '效果', '运行', '速度', '待机时间', '支持', '华为', '手机']","['非常', '待机时间', '音效', '华为', '拍照']",0.9999937817681204,正向
22796761497,2025-04-02 15:22:43,"太感谢京东了，非常的好用，非常的实惠，选择标准版就是因为外观非常好看，颜值高，摸着有质感。抓拍之下图片非常清晰且好看，清晰度高，体验感很好，微距体验好。        感谢京东， 我非常的喜欢这款手机，非常的好用，心心念念的手机终于到了，用了很长时间的曲面屏手机，这款直屏手机实在是太喜欢了，买的白色，好看大气，拍照效果很棒，抓拍很方便，拍出来美美的，微距效果更赞，以后可以美美的拍照啦选择标准版就是因为外观非常好看，颜值高，摸着有质感。抓拍之下图片非常清晰且好看，清晰度高，体验感很好，微距体验好。买了华为 pura70，白色，256g 内存
手机外观挺精致的，手感不错，外观无瑕疵。
像素也挺好的，拍照很好看。想了很久的新手机，外观漂亮，手感超级棒，尤其对于我这种拍照狂来说，简直太赞了。试了一下微距和夜景，画面超清晰，抓拍的马路夜景也很有氛围感，超级棒！从开快递包装的那一刻起，华为Pura 70就以其精致的设计、卓越的性能深深吸引了我。这款手机不仅外观时尚大气，拿在手中更是质感满满，每一次滑动都是享受",5,j***s,雪域白,12GB+512GB,太感谢京东了 非常的好用 非常的实惠 选择标准版就是因为外观非常好看 颜值高 摸着有质感 抓拍之下图片非常清晰且好看 清晰度高 体验感很好 微距体验好 感谢京东 我非常的喜欢这款手机 非常的好用 心心念念的手机终于到了 用了很长时间的曲面屏手机 这款直屏手机实在是太喜欢了 买的白色 好看大气 拍照效果很棒 抓拍很方便 拍出来美美的 微距效果更赞 以后可以美美的拍照啦选择标准版就是因为外观非常好看 颜值高 摸着有质感 抓拍之下图片非常清晰且好看 清晰度高 体验感很好 微距体验好 买了华为 pura70 白色 256g 内存 手机外观挺精致的 手感不错 外观无瑕疵 像素也挺好的 拍照很好看 想了很久的新手机 外观漂亮 手感超级棒 尤其对于我这种拍照狂来说 简直太赞了 试了一下微距和夜景 画面超清晰 抓拍的马路夜景也很有氛围感 超级棒 从开快递包装的那一刻起 华为Pura 70就以其精致的设计 卓越的性能深深吸引了我 这款手机不仅外观时尚大气 拿在手中更是质感满满 每一次滑动都是享受,"['感谢', '京东', '实惠', '选择', '标准版', '外观', '好看', '颜值', '质感', '抓拍', '之下', '图片', '清晰', '好看', '清晰度', '体验', '微距', '体验', '感谢', '京东', '喜欢', '手机', '心心念念', '手机', '终于', '长时间', '曲面', '手机', '这款', '直屏', '手机', '实在', '喜欢', '白色', '好看', '大气', '拍照', '效果', '很棒', '抓拍', '方便', '出来', '美美', '微距', '效果', '更赞', '以后', '美美', '拍照', '选择', '标准版', '外观', '好看', '颜值', '质感', '抓拍', '之下', '图片', '清晰', '好看', '清晰度', '体验', '微距', '体验', '华为', 'pura70', '白色', '256g', '内存', '手机', '外观', '精致', '手感', '不错', '外观', '瑕疵', '像素', '拍照', '好看', '新手机', '外观', '漂亮', '手感', '超级', '尤其', '对于', '这种', '拍照', '来说', '简直', '太赞', '一下', '微距', '夜景', '画面', '清晰', '抓拍', '马路', '夜景', '氛围', '超级', '从开', '一刻起', '华为', 'Pura', '70', '精致', '设计', '卓越', '性能', '深深', '吸引', '手机', '不仅', '外观', '时尚', '大气', '手中', '更是', '质感', '满满', '一次', '滑动', '享受']","['微距', '抓拍', '外观', '好看', '非常']",1.0,正向
21904935934,2024-12-06 20:54:49,到货快，包转完好，很喜欢，开机顺畅，无卡顿，那在手里大小刚刚好。薄厚适中，拍照清晰，运行速度快。,5,灰***8,雪域白,12GB+512GB,到货快 包转完好 很喜欢 开机顺畅 无卡顿 那在手里大小刚刚好 薄厚适中 拍照清晰 运行速度快,"['到货', '包转', '完好', '喜欢', '开机', '顺畅', '无卡顿', '手里', '大小', '刚刚', '薄厚', '适中', '拍照', '清晰', '运行', '速度']","['包转', '无卡顿', '薄厚', '开机', '到货']",0.9999651526603958,正向
23602629989,2025-05-25 21:47:37,"外形外观：大气精巧
屏幕音效：护眼
拍照效果：清晰、逼真，颜色保真
待机时间：适中，不玩游戏一天足够
其他特色：小屏直板，手感好。。。。。。。。。。。。。。",5,j***U,雪域白,12GB+512GB,外形外观 大气精巧 屏幕音效 护眼 拍照效果 清晰 逼真 颜色保真 待机时间 适中 不玩游戏一天足够 其他特色 小屏直板 手感好,"['外形', '外观', '大气', '精巧', '屏幕', '音效', '护眼', '拍照', '效果', '清晰', '逼真', '颜色', '保真', '待机时间', '适中', '玩游戏', '一天', '足够', '其他', '特色', '小屏', '直板', '手感']","['待机时间', '直板', '音效', '保真', '小屏']",0.999999995612699,正向
22623218087,2025-03-18 00:20:33,手机用了很久了，是鸿蒙系统，也不卡顿，效果也不错。很流畅，超大型内存。可以用很久了,5,j***b,雪域白,12GB+1TB,手机用了很久了 是鸿蒙系统 也不卡顿 效果也不错 很流畅 超大型内存 可以用很久了,"['手机', '鸿蒙', '系统', '不卡顿', '效果', '不错', '流畅', '超大型', '内存']","['不卡顿', '鸿蒙', '超大型', '内存', '流畅']",0.9992009075713968,正向
22711196647,2025-03-26 15:25:43,手机颜值很高，看上去就高大上。用起来被有面子，通话信号很好，拍照很是清晰，像素和分辨率也是绝了。,5,j***5,雪域白,12GB+512GB,手机颜值很高 看上去就高大上 用起来被有面子 通话信号很好 拍照很是清晰 像素和分辨率也是绝了,"['手机', '颜值', '看上去', '高大', '起来', '面子', '通话', '信号', '拍照', '清晰', '像素', '分辨率']","['颜值', '像素', '拍照', '分辨率', '通话']",0.9777108372889063,正向
22786266409,2025-04-01 17:34:27,"非常的好用，非常的实惠，非常感谢京东，选择标准版就是因为外观非常好看，颜值高，摸着有质感。抓拍之下图片非常清晰且好看，清晰度高，体验感很好，微距体验好。        感谢京东， 我非常的喜欢这款手机，非常的好用，心心念念的手机终于到了，用了很长时间的曲面屏手机，这款直屏手机实在是太喜欢了，买的白色，好看大气，拍照效果很棒，抓拍很方便，拍出来美美的，微距效果更赞，以后可以美美的拍照啦选择标准版就是因为外观非常好看，颜值高，摸着有质感。抓拍之下图片非常清晰且好看，清晰度高，体验感很好，微距体验好。买了华为 pura70，白色，256g 内存
手机外观挺精致的，手感不错，外观无瑕疵。
像素也挺好的，拍照很好看。想了很久的新手机，外观漂亮，手感超级棒，尤其对于我这种拍照狂来说，简直太赞了。试了一下微距和夜景，画面超清晰，抓拍的马路夜景也很有氛围感，超级棒！从开快递包装的那一刻起，华为Pura 70就以其精致的设计、卓越的性能深深吸引了我。这款手机不仅外观时尚大气，拿在手中更是质感满满，每一次滑动都是享受",5,G***东,雪域白,12GB+512GB,非常的好用 非常的实惠 非常感谢京东 选择标准版就是因为外观非常好看 颜值高 摸着有质感 抓拍之下图片非常清晰且好看 清晰度高 体验感很好 微距体验好 感谢京东 我非常的喜欢这款手机 非常的好用 心心念念的手机终于到了 用了很长时间的曲面屏手机 这款直屏手机实在是太喜欢了 买的白色 好看大气 拍照效果很棒 抓拍很方便 拍出来美美的 微距效果更赞 以后可以美美的拍照啦选择标准版就是因为外观非常好看 颜值高 摸着有质感 抓拍之下图片非常清晰且好看 清晰度高 体验感很好 微距体验好 买了华为 pura70 白色 256g 内存 手机外观挺精致的 手感不错 外观无瑕疵 像素也挺好的 拍照很好看 想了很久的新手机 外观漂亮 手感超级棒 尤其对于我这种拍照狂来说 简直太赞了 试了一下微距和夜景 画面超清晰 抓拍的马路夜景也很有氛围感 超级棒 从开快递包装的那一刻起 华为Pura 70就以其精致的设计 卓越的性能深深吸引了我 这款手机不仅外观时尚大气 拿在手中更是质感满满 每一次滑动都是享受,"['实惠', '非常感谢', '京东', '选择', '标准版', '外观', '好看', '颜值', '质感', '抓拍', '之下', '图片', '清晰', '好看', '清晰度', '体验', '微距', '体验', '感谢', '京东', '喜欢', '手机', '心心念念', '手机', '终于', '长时间', '曲面', '手机', '这款', '直屏', '手机', '实在', '喜欢', '白色', '好看', '大气', '拍照', '效果', '很棒', '抓拍', '方便', '出来', '美美', '微距', '效果', '更赞', '以后', '美美', '拍照', '选择', '标准版', '外观', '好看', '颜值', '质感', '抓拍', '之下', '图片', '清晰', '好看', '清晰度', '体验', '微距', '体验', '华为', 'pura70', '白色', '256g', '内存', '手机', '外观', '精致', '手感', '不错', '外观', '瑕疵', '像素', '拍照', '好看', '新手机', '外观', '漂亮', '手感', '超级', '尤其', '对于', '这种', '拍照', '来说', '简直', '太赞', '一下', '微距', '夜景', '画面', '清晰', '抓拍', '马路', '夜景', '氛围', '超级', '从开', '一刻起', '华为', 'Pura', '70', '精致', '设计', '卓越', '性能', '深深', '吸引', '手机', '不仅', '外观', '时尚', '大气', '手中', '更是', '质感', '满满', '一次', '滑动', '享受']","['微距', '抓拍', '外观', '好看', '非常']",1.0,正向
22245502205,2025-01-16 11:30:26,很漂亮的一只手机，实物挺精致有质感的，手感很好。运行操作也很流畅，没有出现发热卡顿的情况,5,j***8,雪域白,12GB+512GB,很漂亮的一只手机 实物挺精致有质感的 手感很好 运行操作也很流畅 没有出现发热卡顿的情况,"['很漂亮', '一只', '手机', '实物', '精致', '质感', '手感', '运行', '操作', '流畅', '出现', '发热', '卡顿', '情况']","['卡顿', '很漂亮', '手感', '质感', '流畅']",0.9999743633701245,正向
22836851378,2025-04-06 21:15:15,适合女生使用，颜色非常好看，是透亮的浅蓝色，很好搭配手机壳，直面屏幕非常美观，价格也非常合适,5,x***u,冰晶蓝,12GB+512GB,适合女生使用 颜色非常好看 是透亮的浅蓝色 很好搭配手机壳 直面屏幕非常美观 价格也非常合适,"['适合', '女生', '使用', '颜色', '好看', '透亮', '浅蓝色', '搭配', '手机', '直面', '屏幕', '美观', '合适']","['非常', '浅蓝色', '透亮', '直面', '屏幕']",0.9994048042683349,正向
22666611304,2025-03-22 16:49:12,"外形外观：美观
屏幕音效：好
拍照效果：漂亮
运行速度：快
待机时间：长
充电速度快
五星好评",5,5***s,冰晶蓝,12GB+512GB,外形外观 美观 屏幕音效 好 拍照效果 漂亮 运行速度 快 待机时间 长 充电速度快 五星好评,"['外形', '外观', '美观', '屏幕', '音效', '拍照', '效果', '漂亮', '运行', '速度', '待机时间', '充电', '速度', '五星', '好评']","['待机时间', '音效', '速度', '五星', '拍照']",0.9999977975869098,正向
22038105263,2024-12-31 18:23:15,颜色很好看，用起来很流畅，66w快充，充电很迅速，续航也不错，能用很久，华为的手机质量都很好。,5,j***5,雪域白,12GB+512GB,颜色很好看 用起来很流畅 66w快充 充电很迅速 续航也不错 能用很久 华为的手机质量都很好,"['颜色', '好看', '起来', '流畅', '66w', '快充', '充电', '迅速', '续航', '不错', '能用', '华为', '手机']","['66w', '快充', '华为', '续航', '充电']",0.9999775110373939,正向
22530261468,2025-03-08 15:11:07,华为这款手机容量很大，操作流畅，速度快，外观简洁大方，而且手感好，记忆功能也很强大，好评好评！,5,外***奶,羽砂黑,12GB+512GB,华为这款手机容量很大 操作流畅 速度快 外观简洁大方 而且手感好 记忆功能也很强大 好评好评,"['华为', '手机', '容量', '很大', '操作', '流畅', '速度', '外观', '简洁', '大方', '而且', '手感', '记忆', '功能', '强大', '好评', '好评']","['好评', '华为', '手感', '简洁', '大方']",0.9999999938466777,正向
22318855110,2025-01-25 13:41:57,外观非常好看大方，尤其喜欢白色，性能也出色，续航时间长，充电快，华为的品控还是做的非常到位,5,y***2,雪域白,12GB+256GB,外观非常好看大方 尤其喜欢白色 性能也出色 续航时间长 充电快 华为的品控还是做的非常到位,"['外观', '好看', '大方', '尤其', '喜欢', '白色', '性能', '出色', '续航', '时间', '充电', '华为', '品控', '到位']","['品控', '华为', '非常', '续航', '充电']",0.9999996174698664,正向
22271772632,2025-01-20 10:34:53,给员工购买的福利，外观还是挺大气的，音效很好，拍照效果非常好，待机时间长，运营反应速度也特别的快,5,j***w,羽砂黑,12GB+512GB,给员工购买的福利 外观还是挺大气的 音效很好 拍照效果非常好 待机时间长 运营反应速度也特别的快,"['员工', '购买', '福利', '外观', '大气', '音效', '拍照', '效果', '待机时间', '运营', '反应速度', '特别']","['待机时间', '音效', '反应速度', '拍照', '福利']",0.9999995341294995,正向
22348440163,2025-02-07 09:32:27,手机用了一天后效果不错，手感很好，电池充电速度很快也赖用，各种应用程序反应速度也快，赞👍,5,j***h,羽砂黑,12GB+512GB,手机用了一天后效果不错 手感很好 电池充电速度很快也赖用 各种应用程序反应速度也快 赞,"['手机', '一天', '效果', '不错', '手感', '电池', '充电', '速度', '很快', '赖用', '各种', '应用程序', '反应速度']","['赖用', '反应速度', '应用程序', '手感', '充电']",0.9998706572004475,正向
22070305960,2025-01-04 19:26:01,"外形外观：外观完美，是我喜欢的款式
拍照效果：拍照效果也很棒，属于第一次买华为手机果然不错",5,艳***1,雪域白,12GB+512GB,外形外观 外观完美 是我喜欢的款式 拍照效果 拍照效果也很棒 属于第一次买华为手机果然不错,"['外形', '外观', '外观', '完美', '喜欢', '款式', '拍照', '效果', '拍照', '效果', '很棒', '属于', '第一次', '华为', '手机', '果然', '不错']","['拍照', '外观', '效果', '很棒', '华为']",0.9999982617632425,正向
21347632227,2024-09-10 21:07:21,目前还可以，使用久一点再评论,3,F***x,冰晶蓝,12GB+512GB,目前还可以 使用久一点再评论,"['目前', '使用', '一点', '评论']","['评论', '一点', '使用', '目前', '可以']",0.28097085208225325,负向
23612190291,2025-05-26 20:12:13,屏幕分辨率值得夸赞，运行起来一点都不卡顿，比较喜欢玩游戏，完全带的起来手机屏幕颜值挺高,5,你***6,雪域白,12GB+512GB,屏幕分辨率值得夸赞 运行起来一点都不卡顿 比较喜欢玩游戏 完全带的起来手机屏幕颜值挺高,"['屏幕', '分辨率', '值得', '夸赞', '运行', '起来', '一点', '不卡顿', '喜欢', '玩游戏', '完全', '起来', '手机', '屏幕', '颜值']","['屏幕', '不卡顿', '颜值', '玩游戏', '夸赞']",0.9995949069914967,正向
21995400463,2024-12-23 21:19:04,颜色好看，手感丝滑。用起来很流畅，第一次从ios换到华为，操作还在适应中。总的来讲感觉不错，推荐！,5,臻***6,羽砂黑,12GB+512GB,颜色好看 手感丝滑 用起来很流畅 第一次从ios换到华为 操作还在适应中 总的来讲感觉不错 推荐,"['颜色', '好看', '手感', '丝滑', '起来', '流畅', '第一次', 'ios', '换到', '华为', '操作', '适应', '总的来讲', '不错', '推荐']","['总的来讲', '丝滑', 'ios', '换到', '华为']",0.9998352400138032,正向
22761276016,2025-03-30 00:26:57,盒子有透明塑料包着的，是正品原装的，手机颜值很高，这个白色简直无敌了，太好看了，喜欢,5,郭***凡,雪域白,12GB+512GB,盒子有透明塑料包着的 是正品原装的 手机颜值很高 这个白色简直无敌了 太好看了 喜欢,"['盒子', '透明', '塑料', '包着', '正品', '原装', '手机', '颜值', '这个', '白色', '简直', '无敌', '好看', '喜欢']","['颜值', '正品', '原装', '无敌', '包着']",0.722999822560559,正向
22259267781,2025-01-17 12:52:13,"外形外观：很好看   
屏幕音效：音效很牛掰
运行速度：很牛很牛
待机时间：超级超级长",5,艾***苏,冰晶蓝,12GB+512GB,外形外观 很好看 屏幕音效 音效很牛掰 运行速度 很牛很牛 待机时间 超级超级长,"['外形', '外观', '好看', '屏幕', '音效', '音效', '运行', '速度', '待机时间', '超级', '超级']","['音效', '超级', '待机时间', '屏幕', '外观']",0.999997960456231,正向
22359238940,2025-02-09 23:08:23,手机做工精细，手感很好，屏幕清晰，系统反应挺快的。拍照也行，不玩游戏，国补完到手价也很实惠。,5,8***3,雪域白,12GB+512GB,手机做工精细 手感很好 屏幕清晰 系统反应挺快的 拍照也行 不玩游戏 国补完到手价也很实惠,"['手机', '做工', '精细', '手感', '屏幕', '清晰', '系统', '反应', '挺快', '拍照', '玩游戏', '补完', '到手', '实惠']","['补完', '挺快', '玩游戏', '手感', '拍照']",0.9999996557612284,正向
21899023278,2024-12-05 20:48:02,第一次用华为手机真的震撼到我了，不仅外观好看，手感很好，充一次电可以用上两天，不过我也用的很爱惜它，哈哈哈，真的好喜欢这款华为70手机，点赞点赞点赞👍👍👍👍👍,5,j***u,雪域白,12GB+512GB,第一次用华为手机真的震撼到我了 不仅外观好看 手感很好 充一次电可以用上两天 不过我也用的很爱惜它 哈哈哈 真的好喜欢这款华为70手机 点赞点赞点赞,"['第一次', '华为', '手机', '震撼', '不仅', '外观', '好看', '手感', '一次', '两天', '不过', '爱惜', '哈哈哈', '喜欢', '华为', '70', '手机', '点赞点', '赞点']","['华为', '手机', '70', '点赞点', '赞点']",0.9999978903819996,正向
23617127899,2025-05-27 11:08:34,"外形外观：好
屏幕音效：清脆
运行速度：快

京东快递一如既往的快！有国家补贴！值得信赖！",5,盈***紫,雪域白,12GB+512GB,外形外观 好 屏幕音效 清脆 运行速度 快 京东快递一如既往的快 有国家补贴 值得信赖,"['外形', '外观', '屏幕', '音效', '清脆', '运行', '速度', '京东', '一如既往', '国家补贴', '值得', '信赖']","['音效', '国家补贴', '快递', '京东', '一如既往']",0.9999988568606435,正向
22087915732,2025-01-06 11:29:59,手机收到了，相信京东，相信华为，这款手机很不错，也降了不少，很喜欢，手感很好，也很丝滑，很好！,5,s***_,雪域白,12GB+512GB,手机收到了 相信京东 相信华为 这款手机很不错 也降了不少 很喜欢 手感很好 也很丝滑 很好,"['手机', '收到', '相信', '京东', '相信', '华为', '手机', '不错', '不少', '喜欢', '手感']","['手机', '相信', '华为', '京东', '手感']",0.9999267182383664,正向
21919218818,2024-12-09 23:23:30,心机好看，外形不错，看了实体机买的，感觉高大上，屏幕音效很好，拍照效果也很好！值得购买，再便宜一点更好！,5,小***琪,雪域白,12GB+256GB,心机好看 外形不错 看了实体机买的 感觉高大上 屏幕音效很好 拍照效果也很好 值得购买 再便宜一点更好,"['心机', '好看', '外形', '不错', '实体', '机买', '高大', '屏幕', '音效', '拍照', '效果', '值得', '购买', '便宜', '一点', '更好']","['音效', '机买', '心机', '拍照', '屏幕']",0.9999944679320989,正向
22021814629,2024-12-28 19:06:09,手机很喜欢，蓝色也很爱，已经用了一段时间了很满意，现在的手机越来越智能了，用语音更方便了,5,j***2,冰晶蓝,12GB+512GB,手机很喜欢 蓝色也很爱 已经用了一段时间了很满意 现在的手机越来越智能了 用语音更方便了,"['手机', '喜欢', '蓝色', '一段时间', '满意', '现在', '手机', '越来越', '智能', '语音', '方便']","['手机', '语音', '蓝色', '智能', '满意']",0.9998816790803245,正向
